"name","category","summary","description"
"다알리아","일반특징","다알리아는 국화과에 속하는 춘식 구근이다. <","◎ 개화기 : 7월~11월 <br> <br> ◎ 잎 <br> 잎은 대생하고 엽병이 있으며 1-2회 우상으로 갈라지고 소엽은 난형이며 가장자리에 톱니가 있고 정소엽이 가장 크며 엽축에 날개가 다소 있고 표면은 짙은 녹색이며 뒷면은 다소 흰빛이 돈다.<br> <br> ◎ 꽃 <br> 꽃은 7월에서부터 서리가 올때까지 피고 원줄기와 가지 끝에 1개씩 옆을 향해 달리며 지름 5-7.5cm이지만 보다 큰것도 있고 총포편은 6-7개로서 잎같다. 설상화는 본래 8개였다고보지만 명명할 당시에는 겹으로 되어 있었으며 변종에 따라서 빛깔과 꽃의 크기가 다르다. <br> <br> ◎ 줄기 : 원줄기는 높이 1.5-2m로서 털이 없으며 원추형이다. <br> <br> ◎ 뿌리 : 고구마같은 굵은 괴근으로 번식한다. <br> <br> ◎ 분포 : 널리 재배 <br> <br> ◎ 형태 : 다년초 <br> <br> ◎ 크기 : 높이 1.5-2m 정도<br> <br> ◎ 이용방안 : 관상용으로 널리 재배 <br> <br> ◎ 명칭유래 <br> 다알리아란 DAHL씨(氏)를 기념하기 위하여 붙인 속명의 Dahlia에서 생긴 이름이다. 재배법 ◎ 심기<br> 다알리아는 보통 3월 하순에서 4월 중순경에 심는 것이 가장 좋다. <br> 남부 온난 지역은 3월 하순경, 고냉지 지역은 4월 하순이나 5월 중순경에 심는다. 다알리아는 적응력이 강하기 때문에 햇빛이 잘 들고 배수가 잘 되는 곳이라면 어디든지 잘 자란다. <br> 특히 하루 중 최소 6시간 이상 햇빛이 들고 pH6 ~6.5정도의 토양에 심고, 바람을 피할 수 있는 장소가 좋다. <br> 심기 전에 30cm정도 깊이로 토양을 파서 경작한 후 비료를 주고, 배수가 잘 안 되는 토양이라면 모래를 더해 준다. 비료가 구근에 직접 닳지 않도록 하고 구근의 발아 부위를 위로 향하게 해서 심어준다. <br> 구근을 심는 간격은 품종에 따라 다르지만 보통 60 ~80cm간격으로 심어주고, 구근 위로 5cm정도 흙을 덮어준다. <br> <br> <br> ◎ 키우기<br> 다알리아는 표면에 뿌리가 많기 때문에 가벼운 제초 작업을 해주는 것이 필요하다. 줄기가 강한 품종이거나 강풍이 없는 장소에서는 지주가 없어도 좋으나 잎이 크고 줄기가 약한 품종은 지주를 세워 준다. <br> 구근을 심은 곳 옆에 막대기 또는 잔가지 등을 이용하여 지주를 세우고 식물이 자라면 식물과 함께 끈으로 묶어 식물이 쓰러지지 않도록 해준다. <br> 키를 작게 키우고 싶다면 식물의 높이가 커지지 않도록 가지치기를 해주고 더 큰 꽃을 피우려면 가지 끝에 달린 여러 개의 꽃 눈 중 제일 크고 튼튼한 것만 남기고 제거해 주면 더 큰 꽃을 피울 수 있다.<br> <br> <br> ◎ 물주기<br> 날씨가 매우 건조하지 않는 한 다알리아는 꽃이 필 때까지 거의 물을 필요로 하지 않는다. 그렇기 때문에 10일 정도에 한번만 땅에 물을 흠뻑 주면 된다. <br> <br> <br> ◎ 비료<br> 다알리아는 오랫동안 생장 개화를 계속하므로 비료를 조금씩 주고 건조하지 않도록 관리하는 것이 중요하다. 비료는 한 달에 1 ~ 2회 정도 깻묵 썩인 물이나 복합비료를 흙 위에 뿌려주는데 비료가 구근이나 식물에 직접 닳지 않도록 한다.<br> <br> <br> ◎ 병충해<br> 진드기 등이 생기지 않도록 주의하고 발견 했을 경우 알카리 등의 살충제를 이용해서 방제한다. 잎줄기를 침범한 반엽병, 암무늬병, 반점병에는 다이센을 살포한다.<br> <br> <br> ◎ 꽃핀 후의 관리<br> 다알리아 구근은 내한성이 약하기 때문에 겨울에 그냥 두면 얼어버릴 수 있기 때문에 꽃이 핀고 난 후에는 캐내어 저장 하였다가 이듬해에 심어주는 것이 좋다. <br> 꽃이 피고 난 후에 잎과 줄기가 다 시든 11월쯤에는 땅 위로 5 ~10cm정도만 남기고 줄기를 잘라낸 후 삽으로 구근을 파낸다. <br> 뿌리가 다치지 않도록 깊게 파서 구근을 꺼낸 후 흙이 붙어 있는 그대로 그늘에서 이틀 정도 자연 건조 시킨 후에 비닐 봉지 등에 넣어 상자에 담아 5℃정도의 온도에 보관한다. 비교적 온도 변화가 적은 저장고나 지하실 등에 보관한다. 육종 ◎ 원예품종은 영국, 프랑스, 독일, 네델란드 등 유럽의 여러 나라에서 18세기부터 육종이 시작된 이래 1만여 품종 이상 육성된 것으로 추정되며 화형이 크고 작음, 화색의 다양화, 초장, 엽형, 분지성 등이 다양화되어 오늘에 이르게 되었다. <br> <br> - 원예종의 육성에 처음 이용한 원종은 바리아빌리스종(D.variabilis Desf.=D.Pinnata car)이었으며 그 후 코크시네아종(D. coccinea Car.), 쥬아레자이종 (D. juarezii Hort), 메르키종(D. merckii)의 원종이 서로 교배되어 다알리아의 원예종이 성립되었다<br> <br> - 바리아빌리스종은 폼폰형, 포오멀 데코러티브형, 볼형, 싱글형을 육성해 내는 양친으로 사용되었다.<br> <br> - 쥬아레자이종은 줄기가 연약하고 대륜종이어서 쳐지는 단점을 바리아빌리스종을 교배해 줄기를 강하게 개량함으로서 오늘날 캑터스형이 육성되었다. <br> <br> - 쥬아레자이종은 인포멀 데코러티브형과 작약형의 육성에도 관여하여 오늘날 다알리아 화형의 다양화에 기여하였다. <br> <br> - 메르키종은 싱글형의 육성에 사용되었다.<br> <br> - 코크시네아종은 다양한 화색의 다알리아 개발에 이용되어 현재의 다양하고 화려한 다알리아 품종군을 형성하게 되었다. 품종 일반적으로 꽃 형태에 따라서 다음과 같은 여러 가지의 종류로 나누어진다.<br> <br> <br> 1. 홑꽃형 Single-flowering<br> 꽃 잎이 가운데를 중심으로 한 겹으로 피는 꽃으로 크기는 13cm이내이며 높이는 40 ~60cm이다.<br> <br> 2.아네모네형 Anemone-flowering<br> 홑꽃형과 같이 꽃잎이 한 줄로 피고 가운데를 중심으로 통상태의 작은 꽃잎이 모여서 핀다. 높이는 60 ~90cm이다.<br> <br> 3.콜라렛형 Colarette-flowering<br> 바깥쪽에 한 줄의 꽃잎이 있고 안쪽에 조금 덜 발달된 작은 꽃 잎이 2 ~ 3열로 피고, 높이는 75 ~ 120cm이다.<br> <br> 4.데코레이티브형 Decorative-flowering<br> 넓은 꽃 잎이 규칙적으로 겹쳐진 형태로 겹꽃 형태를 말한다. 높이는 150cm정도이다.<br> <br> 5.볼형 ball-flowering<br> 겹꽃으로 꽃 잎이 나선형으로 꽃 모양이 공처럼 둥근 형태로 쇼우형, 팬시형, 큰 폼폰형이라고도 하며 꽃 크기가 13cm이상인 큰 꽃을 말한다. 높이는 80 ~ 120cm정도이다. <br> <br> 6.폼폰형 Pompon-flowering<br> 볼형과 같이 둥근 형태의 꽃으로 볼 형보다 작은 꽃을 말한다. 꽃 크기는 13cm이내이고, 높이는 80 ~ 120cm 정도이다. <br> <br> 7.선인장형 Cactus-flowering<br> 꽃 잎 끝이 바깥 쪽으로 말려 관모양의 작은 꽃잎이 모여 피는 꽃으로 꽃 잎 끝이 뾰족한 형태를 말한다. 높이는 약 150cm정도이다. <br> <br> 8.작약형 Peony-flowering<br> 바깥 쪽 꽃잎이 2 ~ 5줄이고, 바깥 꽃잎과 안쪽 꽃잎의 경계에 작은 꽃 잎이 있다. <br> <br> 9.기타 etc.<br> 그 밖에 난형, 프릴드형, 듀플렉스형, 더블 코스모스형 등이 있다. 2007-09-10"
"프테리스","종류","프테리스는 열대, 아열대에 많이 분포하는 상록","(가) 프테리스 엔시포미스 빅토리아(P. ensiformis cv. Victoriae)<br> 잎중앙에 은백색의 세로줄 무늬가 들어 있고 2회 우상복엽(깃털겹잎)으로 거칠게 열편(갈라진 조각)된 잎이다. 잎길이는 13~18㎝ 이며 잎폭은 6~9mm로 좁고 길쭉한 느낌을 준다.<br> (나) 프테리스 크레티카 알보리네아타(P. cretica cv. Albolineata)<br> 일본 원산 크레티카의 원예종으로 깃털모양과 같은 잎이 1~3개대생을 이루고 있고 길이에 비해 폭이 넓다. 프테리스 크레티카 크리스타타(P. cretica cv. Cristata)는 잎자루가 가늘고 잎의 끝부분이 불규칙하게 닭의 벼슬모양으로 갈라지고 물결모양으로 되어 있다.<br> 재배법 (가) 광과 온도<br> 직사광선을 피하여 차광해 주어야 한다. 재배온도는 15℃ 정도를 유지하며, 특히 겨울철에는 최저 8℃ 이상으로 유지해야 한다. 공중습도는 50% 이상이 되어야 한다.<br> (나) 용 토<br> 용토는 그리 까다롭지 않은데, 일반적으로 부엽토 3 : 양토 1 : 모래 1의 비율로 혼합해 사용한다. 용토의 pH는 5.5~6.5, EC(전기전도도)는 0.3mS 정도로 유지해 준다. 이식은 3~4월경에 분주를 겸해서 한다.<br> (다) 시 비<br> 잘 썩은 깻묵물을 연하게 해서 시비하는데 생육이 왕성한 시기에는 매달 비료를 주고 겨울철에는 시비횟수를 줄여야 한다. <br> (라) 물관리<br> 토양은 비교적 습하게 유지해야 한다. 겨울철에는 관수횟수를 줄인다.<br> 번 식 고사리류의 대부분이 그렇듯이 이 식물도 포자로 번식하기도 하고 성숙한 식물체로 부터 분주하기도 한다.<br> 병해충 충해로는 잎과 눈에 선충류와 깍지벌레류, 온실가루이 등이 있다. 다습한 조건에서는 잎에 반점과 잎마름병이 나타나기도 한다.<br> 2007-09-10"
"산국","산국의 형태및 특성","속명의 크리스산더멈(Chrysanthemum)","산국은 국화과의 여러해살이로 높이 1∼1.5m정도 자라며 줄기 끝부분에 많은 가지가 나오고 그 끝에<br> <br> 꽃이 핀다. 잎은 호생하며 엽병이 있고, 예리한 거치가 있으며 표면과 뒷면에 약간의 털이 나 있다.<br> <br> 개화기는 9∼11월에 황금색으로 가지 끝에 뭉쳐서 핀다. 감국과 다른 점은 꽃이 작고 꽃수가 아주 <br> <br> 많으며 개화시기가 늦은 것이 특징이다. 비교적 개화기간이 긴 편이며 특히 배수병에 강한 저항성을<br> <br> 가지고 있어 육종의 좋은 재료가 된다.<br> <br> 산국의 용도 ㅇ 관 상 용<br> <br> 분화로 이용할 때는 낮은 분을 선택하며, 키가 너무 커지기 쉽기 때문에, 7월 상 중순경 신초의 <br> <br> 끝순을 잘라 삽목하여 육묘한 묘를 식재하면 키가 낮은 상태애서 개화된다. 5월 경에 삽목한 묘의<br> <br> 키를 낮추기 위해서는 1∼2회정도 적심 재배하여야 한다. 분식의 경우에도 분 안에 모양이 좋은 <br> <br> 돌을 1∼3개 정도 배치하고 돌틈 사이나 그 주변에 5∼10포기 정도 식재하면 관상가치가 높다.<br> <br> <br> <br> ㅇ 약 용<br> <br> 꽃은 국화주를 담그거나 그늘에 말려 베개속에 넣으면 은은한 국화향기가 나고 불면증 치료에 도<br> <br> 움을 주며 전초를 두통, 현기증치료에 사용한다.<br> <br> <br> <br> 산국의 재배관리 ㅇ 적 지<br> <br> 재배환경으로는 배수가 잘 되는 양지 바른 곳이 적당하며 식재용토는 일반 마사토 단용 또는 10%<br> <br> 정도의 부엽을 혼합하는 것이 좋다. 특히 건조에 강하기 때문에 노지재배시 돌틈이나 척박한 곳에<br> <br> 심는 것도 키가 작게 자라서 관상가치가 높다.<br> <br> <br> <br> ㅇ 번 식<br> <br> 실생번식은 11월 중 하순경 채종하여 음지에서 건조시켜 저장하였다가 봄에 파종하면 잘 발아된다.<br> <br> 실생묘는 2년이 지나야 개화한다. 절화용으로 재배시는 삽목묘를 이용하는데 5∼6월에 끝순을 잘라<br> <br> 삽목하여 번식시킨 묘를 이용한다. 삽목 번식묘는 당년에 개화주로 번식시킬 수 있는 잇점이 있다.<br> <br> 분주번식은 석부, 분황용으로 1∼2월에 분주하여 번식시킨다.<br> <br> <br> <br> ㅇ 분 관 리<br> <br> 분 재배시 건조에는 강하지만 족 낙엽되어 영양이 결핍되면 꽃달림이 나빠지는 원인이 되기도 <br> <br> 한다. 특히 장마기에 분갈이 한 경우 3∼7일 정도 그늘에서 활착시킨 뒤에 양지바른 곳에서 재배<br> <br> 한다.<br> <br> <br> <br> ㅇ 적 심<br> <br> 적심시기는 늦어도 7월 하순경에 마치도록 하고 키를 낮추기 위해서는 봄부터 2∼3호 적심을 반<br> <br> 복하면 분지수도 늘어나고 키가 낮아져서 안정감 있는 꽃을 감상할 수 있게 된다.<br> <br> <br> <br> ㅇ 복토 및 솎음<br> <br> 재배의 핵심은 햇빛이 잘 들고 배수가 양호한 곳에서 재배하는 것이 중요하다. 노지상태에서는 <br> <br> 매년 흙을 복토해 주거나 뿌리가 엉킨 것을 1∼2년에 1회씩 솎아내 주어야 한다. 노지에 군식 하<br> <br> 였을 경우에는 개화가 끝난 직후 지상부를 잘라주고 흙으로 2∼3㎝정도 복토하여 주거나 밀식이 된<br> <br> 곳은 솎음질 하여 매년 충실한 꽃을 감상할 수 있게 관리한다.<br> <br> <br> <br> ㅇ 시 비<br> <br> 노지재배에서는 비료를 주지 않고 관리하는 것이 좋다.<br> <br> <br> <br> ㅇ 병충해 방제<br> <br> 병충해는 진딧물에 의한 피해가 있으므로 사전예방이나 조기구제에 힘써야 한다.<br> 2007-09-10"
"과꽃","특징","쌍떡잎식물 초롱꽃목 국화과의 한해살이풀로 취국","<br> 줄기는 자줏빛을 띠고 가지를 많이 치며, 풀 전체에 흰 털이 많이 나 있다. 잎은 어긋나고 거친 톱니가 있다. 아랫부분에 난 잎은 꽃이 필 때 없어지는데, 주걱 모양의 잎자루가 있다. <br> <br> 꽃은 국화와 비슷한데 지름 6∼7.5cm로 긴 꽃자루 끝에 1개씩 달린다. 꽃 색깔은 흰색,보라색,빨간색, 분홍색,자주색,노란색, 여러 가지 빛깔이 섞인 색 등 다양하다. 열매는 수과로 납작한 바소꼴의 긴 타원형이며 털이 있다.<br> <br> 화단용과 꽃꽂이용으로 많이 재배한다. 어린 순은 식용한다. 주요품종특성 <br> 과꽃은 절화용 일년초 중 품종수가 비교적 많은 작물이다. 초장의 길이에 따라 고성종, 중성종 및 왜성종으로 구분하고 있으며, 초형에 따라 직립성과 분지성으로 나누는데 직립성은 주지의 중간부위부터 위로 올라 가면서 곁가지가 나오는 형이고 분지성은 주지의 밑부분에서 부터 곁가지가 나오는 형이다. <br> <br> 절화용 품종의 대부분은 직립성이며, 분지성인 것은 분화 및 화단용으로 이용하고 있다. 꽃잎의 형태에 따라 평상(平弁), 관상(管弁), 침상(針弁) 및 정자상(丁字弁)으로 분류하며 꽃의 모양에 따라 홑꽃, 반겹꽃 및 겹꽃으로 구분하기도 하는데 꽃부리(花冠)의 형태와 꽃 모양의 조합방식에 따라 특별히 분류하기도 한다. <br> <br> 또한 품종은 다른 화훼류처럼 개화기의 조만에 따라 조생종, 중생종 및 만생종으로 구분하며 꽃의 색깔에 따라 적, 도, 자, 백, 황색종 등으로 구분한다. <br> <br> <br> 구레나이 <br> <br> 꽃이 선명한 적색에 황색심이 있는 반겹꽃의 중형종으로, 내병성이 강하고 분지수 및 꽃봉오리수가 많은 만생종이다. <br> <br> <br> 유명 <br> <br> 화형이 폼폰형이며 대형종으로 내병성이 강한 중생종이다. <br> <br> <br> 찌구마 <br> <br> 폼폰형이며 중형종으로 생육이 강건하고 이식이 잘되며 내병성이 강한 중생종이다. <br> <br> <br> 비옥 <br> <br> 꽃이 적색의 겹꽃으로 내병성이 강한 조생종이다. <br> <br> <br> 송본시리즈 <br> <br> 심이 황색인 겹꽃으로 내병성이 강한 조생종이며 중심화나 측지화의 개화기 차이가 적어 절화용으로 우수하다.<br> <br> <br> 코마시리즈 <br> <br> 대형의 마가레트형으로 중생종이다. 고성종이면서 분지성이 강하지만 내병성이 다소 약해 쓰러지기 쉽다. <br> <br> <br> 미스시리즈 <br> <br> 대형의 세미오스트릿치형으로 중생종이다. 분지는 거의 없고 줄기가 굵으며 쓰러짐에 강하다. <br> <br> 원산지와 내력 과꽃은 북한의 함경남북도와 중국 북부지역, 서부 티벳, 아프가니스탄에 자생하며 속명이 오래전에는 Aster였으나 현재는 Callistephus로 부르고 있고 국화과에 속하는 일년초이다. <br> <br> 이 종류는 1728년에 발견되었으며 1731년 프랑스 선교사가 씨를 가져가서 키운데에서부터 개량되었다. 그 후 절화용, 화단용으로 재배되는 일년초로 1752년 자주색과 붉은 색 꽃이 개량되었고 1807년 이후 남보라색 등 여러 가지 색이 출현되었는데, 초기에 프랑스, 독일, 영국 등 유럽에서 품종이 개량되었다. 이후 미국에서도 절화용 품종이 육성되고 과꽃에서 많이 발생하는 모잘록병(立枯病)의 저항성 품종도 육성되었으며 최근에는 일본에서 절화용으로 우수한 품종이 많이 개발되고 있다. <br> <br> 현재 우리나라에서 재배되고 있는 품종들은 일본에서 개량된 것들이 많다. 모잘록병에 강한 품종들이 많이 있으나 완전한 저항성을 가진 품종은 아직 없는 실정이다. 연작장해가 있으므로 2∼3년마다 돌려짓기를 하는 것이 좋으며 재경작시에는 토양소독이 필요하다. 도입품종이 많이 나와 있으므로 꽃색, 꽃모양, 초형, 조만성 및 출하기 등을 고려하여 적합한 품종을 선정하여 재배하도록 한다. <br> <br> 파종은 상자의 경우 3cm, 묘상 5cm 간격으로 줄지어 뿌리고 1mm 정도 복토한다. 씨를 뿌린후 1주일이면 발아하는데, 정식의 적기는 본엽이 4～5매 자랐을 때이다. 정식이랑은 1m, 통로는 0.5m가 좋고, 극조생종을 이용한 동계하우스 재배는 12×12cm, 기타 중만생종은 15×15cm 거리로 심는다. 꽃은 파종후 조생종 90일, 중생종 100일, 만생종 110-120일만에 핀다. 2007-09-10"
"해바라기","형태특성","쌍떡잎식물 초롱꽃목 국화과의 한해살이풀로서양지","<br> 중앙 아메리카 원산의 한해살이풀. 높이는 2m에 달하고 염통모양이 달걀꼴이나 길둥근모양의 넓은 달걀꼴로 끝이 뾰족하고 잎가장자리에 큰 톱니가 있다. 꽃은 8～9월에 옆을 향해 달리며, 가장자리의 혀꽃(舌狀花)은 밝은 노란빛이고 중성이며, 대롱꽃(筒狀花)은 갈색이나 노란빛이고 양성이다.<br> <br> 모두꽃싸개(총포)는 조금 둥글고 그 조각은 달걀모양의 바소꼴로 끝에 길고 부드러운 털이 있다. 열매는 얇은열매(瘦果)이며 거꿀달걀꼴이고 흰빛이나 회색 바탕에 검은 줄이 있다.<br> <br> 해바라기의 어원은 ‘꽃이 해를 향해 핀다’라는 뜻의 중국어 향일규(向日葵)에서 유해하며, 영명의 Sunflower는 속명의Helianthus를 번역한 것이다. 속명(Helianthus)은 그리스어 helios(태양)와 anthos(꽃)의 합성어이며 머리꽃의 형태와 태양을 향해 피는 특성에서 기인한다. 종명(annuus)은 ‘일년생의’를 뜻한다. 분류 및 품종 해바라기는 크게 야생종, 관상종, 재배종으로 나뉜다. 관상용종은 혀꽃이 크고 대롱꽃이 작으며 가지를 많이 치고 머리꽃이 작다. 재배종에는 종실이 굵은 식용종과 종실이 잔 채유종이 있다. 식용종은 종피가 딱딱하고 검은빛 무늬가 있다.<br> <br> 가뭄에 약하고 유분함량이 적다. 채유종은 종피가 얇고 종실도 작은 편이다. 종피의 빛깔은 검은빛 외에 여러 가지가 있다. 가뭄에 강하고 유분함량이 많다. 한국에서 재배되고 있는 주요 품종은 재래종과 도입종의 프레도빅(Peredovic), 크라스노다렛(Krasnodarets), 불가리아(Bulgaria), 코멘더(Commender) 등이 있다. <br> <br> ①재래종…한국 전역에 분포돼 있으며, 거의 모두가 만생종이다. 초장(草長)은 2～3m까지 생장한다. 종자 1000알의 무게는 80～90g이고, 종실에 대한 종피의 비율은 약 50%이다. 유분함량은 21～25%이다. ②프레도빅…캐나다와 러시아에서 많이 재배되고 있는 품종으로, 한국에는 1973년에 종자가 대량, 도입됐다. <br> <br> 초장은 1～2m이고 종피의 빛깔은 검은빛이다. 종자 1000알의 무게는 50～60g이고, 유분함량은 35～40%이다. ③크라스노다렛…러시아 계통이며, 캐나다로부터 1973년에 도입한 품종이다. 초장은 140～160cm이고, 종자 1000알의 무게는 60g 내외이다. 유분함량은 34% 가량이고, 조생종에 속한다. 이용방안 <br> ▶종자를 대량 재배하여 식용유으로 하거나 종자 자체를 식용으로 하며 많은 품종이 개발되어 있다. <br> ▶비누 원료, 도료 원료로 쓰인다. <br> ▶종자는 向日葵子(향일규자), 根은 向日葵根(향일규근), 莖隨(경수)는 向日葵莖隨(향일규경수), 葉은 向日葵葉(향일규엽), 花은 向日葵花(향일규화), 花托(화탁)은 向日葵花托(향일규화탁), 果殼(과각)은 向日葵殼(향일규각)이라 하며 약용한다. <br> <br> ⑴向日葵子(향일규자) - 癰膿(옹농)을 속까지 없애는 효능이 있다. 血痢(혈리)를 치료한다. 해바라기油는 被覆藥(피복약)이 되고 또 氣(기)를 疏通(소통)해서 膿(농)을 제거한다. <br> <br> ⑵向日葵根(향일규근) - 二便不通(이변불통), 타박상, 胃腸胸痛(위장흉통), 脇肋滯痛(협륵체통), 消渴引飮(소갈인음), 疳瘡流黃水(감창유황수)를 치료한다. 潤腸通便(윤장통변)한다. <br> <br> ⑶向日葵莖隨(향일규경수) - 血淋(혈림), 尿路結石(요로결석), 乳濁尿(유탁뇨), 小便不利(소변불리-排尿困難(배뇨곤란))를 치료한다. <br> <br> ⑷向日葵葉(향일규엽) - 잎과 꽃은 苦味健胃劑(고미건위제)가 된다. <br> <br> ⑸向日葵花(향일규화) - 祛風(거풍), 明目(명목), 頭昏(두혼), 面腫(면종)을 치료하고 分娩(분만)을 촉진한다. <br> <br> ⑹向日葵花托(향일규화탁) - 두통, 目昏(목혼-눈이 침침해지는 것), 齒痛(치통), 胃·腹痛(위·복통), 월경통, 瘡腫(창종)을 치료한다. <br> <br> ⑺向日葵殼(향일규각) - 耳鳴(이명)을 치료한다. 해바라기에 얽힌 전설 서양에는 해바라기에 얽힌 전설이 내려오고 있습니다. 옛날에 아름다운 두 님프 자매가 살고 있었다. 그리고 이들의 아버지는 엄격하기 그지없는 바다의 신이었다. 아버지는 두 자매에게 낮에는 절대로 세상에 놀러 나가지 말라고 명령했다. <br> <br> 어느날 두 자매는 세상에서 너무나 재미있게 놀던 나머지 아침이 밝아 오는 것도 잊고 말았다. 찬란하게 밝아오는 태양의 신 아폴론을 본 두 자매는 모두 아폴론을 사랑하게 되었다.<br> <br> 아폴론을 독차지하고 싶었던 언니 님프는 아버지에게 동생이 규율을 어겼다고 고자질했고, 화가 난 아버지는 동생 님프를 가둬 버렸다. 언니는 이제 아폴론의 관심을 독차지할 수 있다고 생각했습니다. <br> <br> 그러나 언니의 나쁜 마음을 알아차린 아폴론은 그녀를 거들떠 볼 생각도 하지 않았다. 애타는 마음이 된 언니 님프는 몇날 며칠을 일어선 채로 아폴론을 바라다가 결국 한 포기 꽃으로 변해 버렸습니다. 이 꽃이 바로 해바라기이며, 그래서 오늘날에도 해바라기는 하루 종일 태양만을 바라보고 있다고 합니다. 2007-09-11"
