"name","category","summary","description"
"노랑꽃창포","상세정보","붓꽃과(Iridaceae) 식물입니다. 노란색","* 잎 <br> 잎은 나비 2-3cm로서 길이가 1m에 달하는 것도 있고 2열로 배열하며 양면에 융기한 중앙맥이 있다.<br> <br> * 열매 <br> 삭과는 다소 밑으로 처지며 길이 6-7cm이고 삼각상 타원형이며 끝이 뾰족하고 3개로 갈라져서 갈색 종자가 나온다. <br> <br> * 꽃 <br> 꽃은 5월에 피고 황색이며 꽃 밑에 2개의 큰 포가 있고 외화피는 3개로서 넓은 난형이며 밑으로 처지고 밑부분이 좁아지며 내화피는 3개이고 긴 타원형으로서 선다. 암술대는 기부가 좁으나 갑자기 넓어져 3개로 갈라지며, 다시 2개로 갈라지며 열편에 뾰족한 톱니가 있다. 3개의 수술은 암술대가 갈라진 밑부분과 접해 있다. 자방은 하위로서 원통형이며 황색이다. <br> <br> * 원산지 <br> 유럽 원산이다. <br> <br> * 분포 <br> 관상용으로 재배한다. <br> <br> * 형태 <br> 다년초이다. <br> <br> * 크기 <br> 잎의 길이가 1m에 달하는 것도 있으며 나비 2-3cm이다. <br> 이용 노랑꽃창포는 갈대·줄·부들과 함께 수질정화 능력이 탁월하여 소하천 생태계 복원을 위해 연못가나 물가에 많이 심는데 노랗게 피어나는 꽃은 하천경관에도 일품이다. 또 자생력이 강하고 뿌리를 단단하게 내려 큰물이 지나가도 곧바로 꽃대를 일으키며, 악취제거와 하상 토양유실 방지 역할까지 해내는 마법의 수초이다. 최근 노랑꽃창포에 대한 관심이 높아지면서 전국 도심하천 곳곳에 식재되고 있다. 약용으로 뿌리줄기를 복통, 이뇨 등에 사용한다.<br> 유사종 ▶꽃창포(Iris ensata var. spontanea (Max.) Nakai) : 3-5송이의 보라색 꽃이 핀다. 안쪽 3장의 꽃잎은 넓은 타원형이며 아래로 처진다. 기부에 노란색 쐐기 모양의 무늬가 있다.<br> ▶나나이바이올렛(Nana violet) : 연보라색 꽃이 피고, 바깥 꽃잎과 안쪽 꽃잎이 위를 향하며 가장자리에 잔주름이 있다. <br> 2007-09-19"
"한련초","일반정보","한련초는 쌍떡잎식물 초롱꽃목 국화과의 한해살이","원산지는 한국으로 제주도와 경기도 이남에 분포한다. <br> 형태는 1년생 초본으로, 크기는 높이가 10~60cm정도 이다. <br> 잎은 대생하며 엽병이 없거나 극히 짧고 피침형이며 예두 예저이고 길이 3~10cm, 폭 5~25mm로서 양면에 굳센 털이 있으며 기부 가까이에 굵은 3맥이 있고 가장자리에 잔톱니가 있다. <br> 꽃은 두화는 8~9월에 가지 끝과 원줄기 끝에 1개씩 달리며 지름 1cm내외이고 화경은 길이 2-4.5cm이며 총포는 꽃이 필 때는 구상 종형이고 길이 5mm, 나비 6-7mm이지만 열매가 익을 무렵에는 지름 11mm정도로 되며 총포편은 5-6개로서 녹색이고 긴 타원형이며 예두이다. 설상화관은 백색이고 길이 2.5-3mm, 나비 0.4mm정도로서 끝이 밋밋하거나 2개로 갈라진다. 통상화는 연한 녹색이며 화관이 4개로 갈라진다. <br> 열매는 수과는 흑색으로 익고 길이 2.8mm정도로서 설상화의 것은 세모가 지지만 다른 것은 4개의 능각이 있으며 백색의 돌기가 있고 관모가 없다. <br> 줄기는 높이 10-60cm이며 곧게 자라고 전체에 강모가 있으며 가지는 대생하는 엽액에서 나오기 때문에 대생하고 다시 가지 끝에서 1개의 가지가 자란다. <br> 특징 일년초로서 곧추 자라고 전체에 강모가 있으며 가지는 대생하는 엽액에서 나오기때문에 대생하고 다시 가지 끝에서 1개의 가지가 자란다. <br> 잎은 대생하며 엽병이 없거나 극히 짧은 엽병이 있고 피침형이며 예두 예저이고 양면에 굳센 털이 있으며 기부 가까이에 굵은 3맥이 있고 가장자리에 잔톱니가 있다. 두화는 8~9월에 가지 끝과 원줄기 끝에 1개씩달리며 지름 1cm내외이고 총포는 꽃이 필 때는 구상 종형이고 길이 5mm, 나비 6~7mm이지만 열매가 익을 무렵에는 지름 11mm정도로 되며 총포편은 5~6개로서 녹색이고 긴 타원형이며 예두이다. <br> 설상화관은 백색이고 길이 2.5~3mm, 나비 0.4mm정도로서 끝이 밋밋하거나2개로 갈라지며 수과는 흑색으로 익고 길이 2.8mm정도로서 설상화의 것은 세모가 지지만다른 것은 4개의 능각이 있다. 이용방법 염료 식물로 이용할 수 있다. <br> -우리나라, 일본에서는 한련초를 염료 식물로 이용한 기록이 없으나 인도에서는 한련초 즙에서 흑색염료를 얻었다. <br> <br> 全草를 墨旱蓮(묵한련)이라 하며 약용한다. <br> ①여름, 가을에 채취하여 흙이나 모래를 제거해서 햇볕에 말리던가 그늘에 말린다. <br> ②성분 : 전초에는 saponin, nicotine, tannin, 비타민A, ecliptine, 다종의 thiophene 화합물, 예를 들면 α-terthienyl methanol 및 그 醋酸(초산)에스테르 등을 함유하고 있다. 잎에는 wedelolactone, demethylwedelolactone-7-glucoside가 함유되어 있다. <br> ③약효 : 凉血(양혈), 止血(지혈), 補腎(보신), 益陰(익음)의 효능이 있다. 吐血(토혈), 咳嗽時 出血(해수시 출혈), 鼻出血(비출혈), 尿血(요혈), 便血(변혈), 血痢(혈리), 刀傷出血(도상출혈), 鬚髮早白(수발조백-若白髮(약백발)), 디프테리아, 淋濁(임탁), 帶下(대하), 陰部濕痒(음부습양)을 치료한다. <br> ④용법/용량 : 10-30g을 달인다. 또는 바짝 졸여서 膏(고)로 만들거나, 짓찧어 즙을 내거나 丸劑(환제), 散劑(산제)로 해서 복용한다. 짓어서 바른다. 가루를 살포하거나 또는 짓찧어 부드럽게 해서 코에 넣는다. <br> <br> 풀 전체를 약재로 쓰는데 민간에선 지혈제로 사용하며, 특히 혈분 치료에 쓴다. 2007-09-19"
"서양민들레","특징","쌍떡잎식물 초롱꽃목 국화과의 여러해살이풀.","유럽이 원산지인 귀화식물로 도시 주변이나 농촌의 길가와 공터에서 흔히 볼 수 있다. 뿌리가 땅속 깊이 들어가고 줄기는 없다. 잎은 뿌리에서 뭉쳐나고 사방으로 퍼지며 타원 모양이고 끝이 예리하게 뾰족하며 깃 모양으로 깊게 갈라지고 가장자리가 밋밋하다. 꽃 꽃은 3∼9월에 황색으로 피고 잎이 없는 꽃대 끝에 두상화(頭狀花:꽃대 끝에 꽃자루가 없는 작은 꽃이 많이 모여 피어 머리 모양을 이룬 꽃) 1개가 달린다. 두상화는 지름이 2∼5cm이고, 총포 조각은 줄 모양이며 녹색 또는 검은 색이 돌고 털이 없으며, 바깥쪽 포 조각은 뒤로 젖혀지고 안쪽 포 조각은 곧게 선다. 열매 꽃은 양성으로서 3-9월에 피며 모두 열매를 맺고 지름 2-5cm로서 황색이며 잎이 없는 화경끝에 1개씩 위를 향해 달린다. 총포편은 선형이고 녹색 또는 검은빛이 돌며 털이 없고 외포편은 뒤로 젖혀지며 내포편은 곧추선다. 화상(花床)은 나출된다. 분포 지리적으로 북미와 아시아 등지에 분포<br> 전국의 도시와 도시 근교에 분포한다. 2007-09-19"
"회리바람꽃","회리바람꽃 이야기","바람꽃이라는 이름이 붙은 식물들은 바람에 흔들","꽃잎이 없어 줄처럼 생긴 꽃받침이 꽃잎처럼 보인다. 꽃받침은 아래로 처져 <br> 꽃줄기에 달라붙고 꽃술만 둥글게 보인다. 포(苞)가 밀집된 총포는 잎 모양으로 <br> 3개가 돌려 난다. 포는 3개로 갈라지는데, 가운뎃조각을 제외한 양쪽의 갈래조각은 다시 2갈래로 갈라지기도 하며 깊이 패인 톱니가 있다. 포의 양면에는 흰색 털이 길게 나 있다. 깊은 산지에 분포하며 숲속 그늘을 좋아한다. 정원이나 공원에 관상용으로 심는다. 다른 미나리아재비과 식물과 마찬가지로 유독성 식물이므로 먹어서는 안 된다.<br> 회리바람꽃 일반 정보 잎 <br> 근생엽은 없다. 총포엽은 3개로서 윤생하며 포엽은 3개로 완전히 갈라지고 열편은 우상으로 갈라지며 가장자리에 결각상의 톱니가 있고 중앙부의 양면에 흰색의 긴 털이 있으며 양끝이 좁고 길이 3-7cm, 폭 9-25mm로서 피침형이며 양쪽 열편이 다시 2개로 갈라지는 것도 있다.<br> <br> <br> 열매 <br> 열매는 수과이다. <br> <br> 꽃 <br> 근경끝에서 화경(花莖)이 나와 높이 20-30cm정도 자란다. 꽃은 5월에 피고 백색이며 화경(花梗)은 길이 2-3cm로서 털이 있고 1-2개가 나와 끝에 1개의 꽃이 달리며 밑부분에 소포가 있다. 꽃받침잎은 5개이고 넓은 선형이며 길이 6mm, 폭 2mm로서 겉에 백색털이 있고 자방은 백색의 퍼진 털이 있다. <br> <br> 뿌리 <br> 근경은 지름 2mm정도이고 육질이며 옆으로 자라고 끝에서 1개의 화경(花莖)이 나온다. <br> <br> 원산지 <br> 한국 <br> <br> 분포 <br> 강원도(대관령, 설악산) 이북의 산지에 분포한다. <br> <br> 형태 <br> 다년초 <br> <br> 크기 <br> 화경(花莖)의 높이가 20-30cm 정도 자란다. <br> 2007-09-19"
"피라칸다","특징","피라칸다는 피라킨사스라고도 불리고, 중국이 원","피라칸다의 원산지는 중이으로 피라틴사스라고도 불린다.<br> <br> 피라칸다의 분포는 전북 및 경북 이남에서 생육하나 중부지방에서도 곳에 따라 자랄 수 있으나 이때는 잎이 떨어진다. <br> <br> 피라칸다는 장미과의 상록 또는 낙엽관목으로 정원이나 조경수로 사용된다.<br> <br> 형태는 상록 활엽 관목 또는 소교목(중부지방에서는 잎이 떨어진다.) 이다. <br> <br> 크기는 높이 1-2m 정도로 자란다. <br> <br> 열매는 붉은색이나 주황색이다.<br> <br> <br> <br> 피라칸다 잎은 호생하고 두꺼우며 선상 타원형이고 둔두 설저이며 길이 5-6cm, 폭 5-10㎜로서 뒷면에 짧은 백색 융모가 밀생하며 회백색이고 끝이 둔하며 가장자리가 밋밋하다. 단지에서는 속생한다.<br> <br> 꽃은 5-6월에 피고 지름 4-5mm로서 백색 또는 연한 황백색이며 가지 윗부분의 엽액에서 산방화서가 발달하고 소화경은 짧으며 꽃받침의 겉부분과 더불어 회백색의 짧은 털이 있다. 꽃받침은 끝이 5개로 갈라지고 열편은 넓은 삼각형이며 꽃잎은 5개로서 도란형이고 때로는 끝이 파진다. <br> <br> 줄기는 예리한 가시가 있으며 가지가 많이 갈라져서 엉키고 수관이 둥글며 어린 가지에 연한 황색의 짧은 털이 밀생한다. <br> <br> 열매는 편평한 구형이며 지름 5-6mm로 끝이 약간 들어가고 꽃받침이 남아 있으며 10-12월에 황적색으로 성숙한다. <br> <br> <br> 2007-09-20"
"서양메꽃","특징","쌍떡잎식물 통화식물목 메꽃과의 덩굴성 여러해살","기는줄기의 길이 1∼2m이다. 줄기는 짙은 녹색으로 덩굴을 이루어 땅 위를 기며 줄기에는 털이 거의 없다. 잎은 마주나며 길이 2∼7㎝로 달걀 모양 또는 긴 타원형이다. 잎 가장자리에는 톱니가 없으며, 잎자루는 잎몸보다 약간 짧다. 7∼8월에 잎겨드랑이에서 꽃대가 나온다. <br> 꽃 꽃은 7-8월에 피며, 꽃자루는 잎 겨드랑이에 생기며, 길이 4-9㎝로 잎과 같은 길이이거나 길고 1-4개의 꽃(보통은 2개)이 달리며, 꽃자루의 끝에 2개의 포엽이 있다. 포엽은 마주나기를 하며 도피침형, 길이 3-4㎜이다. 꽃받침은 5개로, 장타원형, 끝이 둔두이며 길이 4-5㎜이다. 꽃잎은 담홍색 또는 거의 백색이며 지름 3㎝이다. 암술머리는 2심열(2深裂)되고, 선형(線形)이다. 잎 잎은 어긋나기(互生) 잎차례이며, 잎자루는 가늘고 잎새보다 짧다. 잎새는 난형(卵形) 또는 장타원형이고, 길이 2-7㎝, 폭 1-5㎝, 잎 가장자리는 톱니가 없고, 끝이 둔두(鈍頭) 또는 원두(圓頭)이고 기부는 전저(箭底) 또는 극저(戟底)이다.<br> 분포 전라북도 군산에서 채집하였고 군산항 부근 철도 연변에서 다수 발견된다. 2007-09-20"
"호주명아주","특징","호주명아주는 명아주과로 냄새명아주라고도 한다.","호주명아주의 원산지는 오스트레일리아이다. <br> <br> 호주명아주의 분포는 전라 북도 운봉에 야생한다. <br> <br> 형태는 1년생 초본으로 크기가 높이 30-40㎝정도로 자란다. <br> <br> 개화기는 7월~8월이다.<br> 호주명아주 <br> <br> 잎은 호생, 잎자루가 있고, 긴 타원형, 길이 1-3㎝, 폭 1.5㎝ 가량이다. 잎 가장자리에 3-4쌍의 파상 톱니, 엽질이 두껍고, 다세포로 된 털이 난다. 잎 뒷면에 황색 선점이 있다.<br> <br> <br> < 꽃 ><br> <br> 꽃은 잎겨드랑이에 모여 붙고, 지름 3-5㎜의 덩어리로 되어있다. 화피는 5장, 녹색, 다육이며, 다세포로 된 털이 퍼져 나고, 화피는 열매를 둘러싼다. <br> <br> < 줄기 ><br> 줄기는 30-40㎝로 갈라지고, 짧은 털이 줄기와 잎자루에 나며, 털의 일부는 선모로 된다. <br> 2007-09-20"
"호제비꽃","특징","호제비꽃은 제비꽃과의 다년초로 양지쪽 풀밭이나","호제비꽃의 원산지는 한국으로 서울 근교, 신촌 일대, 중국의 하북, 하남, 산동, 호남, 호북, 복건 등에 분포한다. <br> <br> 형태는 다년생 초본으로, 개화기는 3월~4월이다.<br> <br> 호제비꽃의 크기는 높이가 7-15cm 정도로 자란다. <br> <br> 제비꽃과로 들오랑캐, 들제비꽃이라고도 한다. 호제비꽃 <br> <br> 잎은 삼각상 넓은 피침형이며 끝이 둔하고 밑부분이 절저 예저 또는 다소 심장저이며 가장자리에 파상의 톱니가 있고 길이 3-6cm, 폭 1-2cm이지만 과시에는 길이 8cm, 폭 3cm에 달한다. 엽병은 잎보다 짧고 길이는 2-5cm이지만 때로는 15cm에 달하는 것도 있고 윗부분에 날개가 약간 있는 것도 있다.<br> <br> <br> < 열매 ><br> 삭과로서 난상 타원형이고 5~8월에 성숙하며, 종자는 황색으로 난원형이고 활택(滑澤)하다. <br> <br> < 꽃 ><br> <br> 화경은 잎과 길이가 비슷하거나 다소 짧다. 꽃은 자주색이며 3~4월에 피고 꽃받침잎은 피침형이며 길이 5-7mm로서 끝이 뾰족하거나 둔하고 부속체는 둥글며 밋밋하거나 둔한 톱니가 있다. 꽃잎은 길이 10-14mm이고 측열편에 털이 없으며, 거(距)는 길이 5-7mm로서 둥글다. <br> <br> < 줄기 ><br> <br> 전체에 짧은 털이 밀생한다. <br> <br> < 뿌리 ><br> 근경은 짧다. <br> 2007-09-20"
"찔레꽃","찔레꽃의 일반정보","식물명 : 찔레꽃 <br> 찔레나무, 가시나무","원산지 : 한국 <br> <br> 분 포 : 일본에도 분포한다. 전국 산야의 표고 50-1,950m 사이의 산기슭과 계곡에서 흔히 볼 수 있다. <br> <br> 형 태 : 낙엽 활엽 관목 <br> <br> 크 기 : 높이 2m가량 된다. <br> <br> 잎 : 잎은 호생하며 5-9개의 소엽으로 구성된 우상복엽이며, 소엽은 타원형 또는 도란형이고 첨두, 원저이며 길이 2-3cm, 폭 1-2cm로서 표면에 털이 없고 뒷면에 잔털이 있으며 가장자리에 잔톱니가 있다. 탁엽에는 빗살같은 톱니가 있고 밑부분이 엽병과 합쳐진다. <br> <br> 꽃 : 꽃은 5-6월에 피고 새가지 끝에 원추화서를 이루며 지름 2cm정도이고 백색 또는 연홍색이며 소화경에 털이 없거나 선모가 약간 있고 꽃받침잎은 피침형으로 뒤로 젖혀지며 안쪽에 융모가 있다. 꽃잎은 도란형이고 미요두(微凹頭)이며 향기가 있다. 수술은 여러개이고 꽃밥은 노란색이다. 꽃받침, 꽃잎이 5개씩이다. <br> <br> 열 매 : 열매는 장과로서 둥글고 지름 8mm정도로 9-10월경에 적색으로 익는다. 종자는 길이 3㎜정도로서 백색이며 털이 나 있다. <br> 줄 기 높이가 2m에 달하고 줄기는 곧게 서거나 비스듬히 옆으로 뻗으며 가지끝이 밑으로 처지고 흔히 덩굴성으로 되며, 소지는 녹색이지만 겨울에 붉게 되고 가시가 있고 털이 있는 것도 있다 <br> 생육환경 습기가 많은 하천이나 호반 주변에서 많이 자라며 배수가 잘 되는 양지 바른 곳이 좋다. 생장이 빠르며 내한성과 내조성, 내염성, 내공해성이 강하다. 번식방법 습기가 많은 하천이나 호반 주변에서 많이 자라며 배수가 잘 되는 양지 바른 곳이 좋다. 생장이 빠르며 내한성과 내조성, 내염성, 내공해성이 강하다. 이용방안 관상용, 생울타리용으로 사용하고 장미의 원예품종을 번식시킬 때 대목으로 이용된다. <br> 맹아지의 새순은 식용할 수 있다. <br> 염료용으로 이용한다. - 흔히 갈색 계통의 염료를 얻기 위해 이용되는 식물이다. 빨간 열매를 이용하면 옅은 갈색을 얻을 수 있다. 잎의 염액은 적갈색으로 탁하다. 매염제에 대한 반응은 가을에 채집한 것이 보다 좋았다. <br> 花는 薔薇花(장미화), 根은 薔薇根(장미근), 莖은 薔薇枝(장미지), 葉은 薔薇葉(장미엽), 과실은 營實(영실)이라 하며 약용한다. <br> ⑴薔薇花(장미화) - ①5-6월 꽃이 한창 피었을 때 맑은 날씨에 채취하여 햇볕에 말린다. ②성분 : astragalin이 함유되어 있고 精油(정유)에는 0.02-0.03% 전후가 함유되어 있다. ③약효 : 淸暑(청서), 和胃(화위), 止血(지혈)의 효능이 있다. 暑熱吐血(서열토혈), 口渴(구갈), 瀉痢(사리), 말라리아, 刀傷出血(도상출혈)을 치료한다. ④용법/용량 : 3-6g을 달여 복용한다. 粉末(분말)을 살포한다. <br> ⑵薔薇根(장미근) - ①연중 수시로 채취하여 깨끗이 씻어 햇볕에 말린다. ②성분 : 뿌리에는 tormentin acid가 함유되어 있고 근피에는 tannin 23.3%, 生葉에는 비타민C 61.6mg%가 함유되어 있다. ③약효 : 淸熱(청열), 利濕(이습), 祛濕(거습), 活血(활혈)의 효능이 있다. 肺癰(폐옹), 당뇨병, 이질, 관절염, 사지마비, 吐血(토혈), 鼻出血(비출혈), 頻尿(빈뇨), 遺尿(유뇨), 월경불순, 타박상, 瘡癤疥癬(창절개선)을 치료한다. ④용법/용량 : 4.5-12g을 달여서 복용한다. 짓찧어서 붙인다. 煎液(전액)으로 양치질을 한다. <br> ⑶薔薇枝(장미지) - 婦人(부인)의 禿髮(독발)에 찔레의 햇가지와 후조(원숭이 내장 結石(결석))를 같이 삶아서 그 煎汁(전즙)을 바른다. <br> ⑷薔薇葉(장미엽) - 짓찧어서 붙이면 生肌(생기)의 효능이 있다. <br> ⑸營實(영실) - ①8-9월에 열매가 빨갛게 익기 전 푸른색이 조금 남아 있을 때 따서 그늘에서 건조하여 공기가 들어가지 않도록 밀봉한다. ②성분 : 利尿(이뇨), 해독, 瀉下(사하), 除熱(제열), 活血(활혈)의 효능이 있다. 腎炎(신염), 浮腫(부종), 尿不利(요불리), 脚氣(각기), 瘡疥癰腫(창개옹종), 小便秘澁(소변비삽), 月經腹痛(월경복통)을 치료한다. ③용법/용량 : 3-9g을 달여서 복용한다. 술에 담그거나 丸劑(환제), 散劑(산제)로 하여 복용한다. 짓찧어서 붙이거나 煎液(전액)으로 씻는다. ▶덩굴장미(var. platyphylla THORY): 낙엽 덩굴성 관목으로 길이 5m에 달하고 전체에 밑을 향한 가시가 드문드문 있으며, 엽축과 잎자루에 가시가 있고 꽃이 적색이다. <br> ▶털찔레(=털가시나무, var. adenochaeta OHWI)(var. pilosissima Nakai): 잎과 화서에 선모가 많다. <br> ▶좀찔레(=좀가시나무, var. quelpaetinsis NAK.): 소엽의 길이가 1-2cm이고 꽃이 작다. <br> ▶제주찔레(R. luciae FR. et ROCKHEB.) : 탁엽의 가장자리가 거의 밋밋하고 암술대에 털이 있다. <br> ▶국경 찔레꽃(R. jaluana KOM.): 제주찔레와 비슷하지만 꽃이 적색이고 탁엽에 톱니가 있다. <br> ▶돌가시나무(R. wichuraiana): 반상록포복성이고 꽃의 지름 4cm로 소엽은 7-9개가 난다. <br> ▶용가시나무(R. maximowicziana): 포복성, 소엽은 5-7개이다. 2007-09-20"
"졸방제비꽃","특징","제비꽃과의 다년생 쌍떡잎식물인 졸방제비꽃은 산","다년생 초본식물로 원줄기가 없으며 뿌리는 황갈색으로써 많으나 뿌리에서 긴잎자루가 있는잎이 돋는다. 잎은 피침형으로써 끝이 둔하지만 가장자리에는 얕고 둔한 톱니가 있으며잎자루에는 날개가 뚜렷하다. 꽃이 핀다음에 자라나는 잎은 난상 삼각형으로써 윗부분에 약간 뚜렷하지않는 물결모양의 톱니가 있으며 잎자루는 윗부분에 날개가 있다. 꽃은 4-5월 잎겨드랑이에서 꽃줄기가 나와 짙은 자주색 꽃이 달리며 간혹백색 바탕에 자주색 줄이 있는 꽃이 피는 것도 있다. 꽃받침잎은 피침형이나 끝이 뾰족하고 부속체는 반원형으로 가장자리가밋밋하고 꽃잎은 측열편에 털이 있거나 없으며 거는 짧은 원주형이다. 분포와 용도 분 포<br> 우리 나라, 일본, 중국에 분포하며 산록의 양지에서 자란다. <br> <br> <br> 용 도<br> 한방과 민간에선 간장 기능촉진,감기,거풍 등에 사용하며 어린순을 나물로 한다. 졸방제비꽃은 어린 순을 식용하고, 한방 및 민간에서 간장기능 촉진, 감기, 거풍, 청열, 해독, 소종, 지통, 종독, 타박종통 등에 약재로 이용한다. <br> 2007-09-20"
"세로페기아","종류및 특성","이 속은 아프리카, 마다가스칼, 열대아시아,","이 속은 아프리카, 마다가스칼, 열대아시아, 열대오스트레일리아 원산으로 160 여종이 있다. 대부분 다육성(多肉性)이고 덩굴성인 것이 많다.<br> <br> (가) 세로페기아 우디(C. woodii)<br> 남아프리카 원산으로 지름 0.5~1mm의 가느다란 줄기를 가진 덩굴성의 다육식물이며 걸이분용으로 아주 좋은 식물이다. 잎은 대생으로 나며, 길이 1.5~2cm의 하트형이고 꽃은 지름 2.5cm 정도의 통모양이다. 지하에는 덩이뿌리가 있고 줄기가 지면에 닿으면 마디에서 뿌리를 내어 덩이뿌리를 만든다.<br> <br> (나) 세로페기아 데빌리스(C. debilis)<br> 아프리카 남동부 원산이다. 약간 다육질이며 가늘고 긴 잎이 덩굴처럼 난다.<br> <br> 재배법 (가) 광과 온도<br> 적정광도는 30,000~40,000lux이다. 생육적온은 20~25℃이며 겨울철에 최저온도를 15℃ 이상으로 유지하면 계속 신장시킬 수 있다. 내한성이 강한 편이므로 용토를 건조시키면 5~7℃에서 월동한다.<br> <br> (나) 용 토<br> 배수가 잘되고 유기물이 풍부한 것을 사용한다.<br> <br> (다) 시 비<br> 2년에 1회 분갈이를 하며 이때 용토 1ℓ당 2g 정도의 화학비료를 넣거나 생육기에 월 2~3회 액비를 준다. 1년 시비량은 1,008kg(N-P2O5-K2O)/ha이다. 과다한 비료는 금물이다.<br> <br> (라) 물관리<br> 잎이 다육질이기 때문에 과잉 관수를 피해야 하는 것이 재배상의 가장 중요한 요점이다. 특히 겨울까지는 관수횟수를 더 줄인다. 수분이 지나치면 식물체가 죽지는 않더라도 활력이 떨어지고 잎색이 퇴색된다. 또한 온도가 20℃ 전후일 때 습도가 높으면 잎이 부패하기 쉬우므로 환기를 잘해야 한다.<br> <br> (마) 번 식<br> 번식은 삽목으로 하는데 모주의 줄기를 한마디씩 잘라 출하용 분에 꽂으면 된다. 온도가 17℃ 정도이면 연중 어느 때나 삽목이 가능하다. 삽목 용토는 피트모스, 퍼라이트, 버미큘라이트를 같은 양으로 혼합한 것을 사용한다. 2주 정도 지나면 뿌리가 내리고 1개월이 되면 덩이줄기 뿌리가 나온다.<br> <br> (바) 병해충<br> 20℃ 전후 온도가 높을 때 잎이 부패하기 쉬우므로 통풍이 좋도록 하면서 정기적으로 살균제를 살포한다. 가루깍지 벌레가 발생한다.<br> <br> 2007-09-20"
