"name","category","summary","description"
"아마릴리스","품종","주로 분화용으로 많이 이용되나 최근에는 절화용","아마존 : 줄무늬에 스포트가 있는 대형화 품종으로 화경장은 65㎝이고 겹꽃종이다. 조생이면서 착화상태가 좋다. 현재까지의 겹꽃 아마릴리스 중에서 여러 면에서 최우수품종임.<br> 아프로디테 : 매우 부드러운 파스텔 화색의 대형화 품종이다. 화경장은 50㎝로 짧은 편이나 꽃과 잎의 조화가 잘 맞는다. 절화용으로 이용하려면 화경장이 짧아지지 않게 적온범위에서 관리해야 한다.<br> 안데스 : 샤몬핑크색의 대형화 품종으로 꽃의 볼륨은 아프로디테보다 약간 작으나 길이는 55㎝정도로 오히려 길다. 잎은 직립하는 성질이 있고 조생종이며 절화용으로 이용하려면 아프로디테처럼 적온을 유지해 화경장을 잘 관리해야 한다. <br> 크리스마스 기프트 : 순백색의 환변화(丸弁花)로 초세가 강하고 개화가 쉬움.<br> <br> <br> <br> 2007-10-08"
"체꽃","특징","쌍떡잎식물 합판화군 꼭두서니목 산토끼꽃과의 여","잎 <br> 근생엽은 꽃이 필 때 없어지며, 경생엽은 대생하고 긴 타원형 또는 난상 타원형이며 끝이 둔하거나 뾰족하고 가장자리에 결각상의 큰 톱니가 있으며 우상으로 갈라진다. 엽병에는 날개가 있고 엽면과 더불어 백색털이 다소 밀생한다.<br> <br> 열매 <br> 열매는 10월에 익는다. <br> <br> 꽃 <br> 꽃은 8월에 피며 하늘색으로서 두상화서에 달리고 외총포편은 선상 피침형이며 양면에 털이 있고 끝이 뾰족하며 꽃이 필 때는 길이 5mm정도이다. 가장자리의 꽃은 길이 13mm정도이고 겉에 털이 밀생하며 5개로 갈라지고 바깥열편이 가장 크며 중앙부의 꽃은 통상화로서 4개로 갈라진다. <br> <br> 줄기 <br> 높이가 50-90cm정도이고 퍼진 털과 꼬부라진 털이 있다. <br> <br> 뿌리 <br> 굵은 뿌리가 땅속 깊이 들어가거나 돌틈 등을 비집고 들어가 자란다. <br> <br> 원산지 <br> 한국 <br> <br> 형태 <br> 2년초 <br> <br> 크기 <br> 높이 50-90cm로 자란다. <br> 2007-10-08"
"양배추(병충해 방제 )","충해","영국과 유럽 대륙의 바닷가 근처에서 자라던 야","가. 진딧물 <br> 진딧물의 피해는 직접적으로는 어린 싹이나 잎 뒷면에서 떼를 지어 작물의 즙액을 빨아 먹음으로서 잎이 위축되어 오그라들고 생육이 정지되며, 간접적으로는 100여종의 바이러스를 옮기므로 막대한 피해를 준다. 진딧물은 복숭아, 배 등 과수나 무, 배추, 고추 등의 채소, 잡초 등에 기생하였다가 작물을 가해한다. 방제는 파종전 다이아톤 입제 또는 아시트 입제를 토양처리하여 잡초의 뿌리 부분에 있는 진딧물을 제거한다. 재배중에 발생하면 메타시스톡스, 메소밀 수화제나 피리모 수화제, 마라치온 유제 등을 살포한다. <br> 나. 좀나방 <br> 배추, 무, 양배추 등 배추과 채소에 피해를 주는데 알에서 갓 태어난 어린 벌레는 잎 속으로 굴을 파고 들어가 식물체를 먹고, 큰 벌레는 잎 뒷면에서 엽맥만 남기고 잎 전체를 가해한다. 좀나방의 성충은 다른 나비류에 비해 크기가 작으며 앞날개의 색은 흑갈색을 띠고 날개를 접으면 중앙에 다이아몬드 모양의 유황색 무늬가 있다. 알은 타원형이고 길이 0.5㎜, 폭 0.3㎜정도되며 노란색을 띤다. 애벌레는 방추형인데 다자란 것은 몸길이 10㎜내외이며 색깔을 주로 녹색이지만 때로는 연노랑색이 섞여 있기도 하다. 좀나방은 늦봄부터 초여름에 발생이 특히 많고 한 여름에는 발생이 격감된다. 가을에는 보통 발생이 적지만 해에 따라서는 많이 발생하는 경우도 있으며 최근에는 고랭지 재배시 많이 발생하고 있다. 좀나방의 피해가 심한 곳에서는 연작을 피하고 주변의 필요없는 기주식물을 제거하여 발생원을 없애고 가을 수확 후 잔재물을 완전히 제거하여 월동서식처를 없앤다. 약제를 이용할 경우에는 프로치오포스 유제, 피레스 유제, 프로싱 유제, 비티 수화제 등을 살포하는데 좀나방은 약제 저항성이 높으므로 작용 기작과 계통이 다른 약제를 바꾸어 살포해야 한다. <br> 다. 배추 흰나비 <br> 어린 벌레는 표피를 남기로 잎살만 가해하나 애벌레가 차차 커짐에 따라 잎줄기만 남기고 모두 먹어 버린다. 특히 가을과 봄에 피해가 심하고, 심한 피해를 받은 양배추는 결구되지 않는다. 애벌레(청벌레)는 일반 살충제에 대하여 비교적 약하므로 델타린 유제, 피리모 유제, 비티 수화제, 프로싱 유제 등을 살포한다. <br> 병해 가. 부패병 <br> 월동재배에서 많이 발생하며 결구 윗부분에서부터 흑갈색으로 변색되면서 부패하여 점차 아랫잎이 황갈색으로 변하면서 시든다. 동해 피해를 입지 않도록 하고 건조하지 않도록 관리한다. <br> <br> <br> 나. 뿌리썩음병 <br> 여름 및 가을재배에서 많이 발생하는데 종자에 붙어 전염하거나, 병든 포기가 토양에 묻혀 전염하며 주로 줄기에서 많이 발생한다. 병징은 토양 가까이에 있는 어린 줄기나 잎에 발생하는데 처음에는 붉은 빛 나는 갈색의 반점이 생기고 이것이 점차 퍼져 부정형의 회색으로 변한다. 물빠짐이 나쁜 밭에서 많이 발생하므로 배수를 철저히하고 발병된 포기는 발견 즉시 제거, 소각하고 발병한 포장은 배추과 작물을 재배하지 말고 3년간 화본과 작물과 윤작한다. <br> <br> <br> 다. 무름병 <br> 고온다습할 때 많이 발생하는데 땅과 닿는 부분이나 지하부의 상처부위에서 수침상의 반점이 생겨 점차 포기전체로 퍼지면서 엿빛으로 흐물흐물하게 썩고 병에 걸린 부위에서는 심한 악취가 난다. 질소과다, 배수가 불량한 밭에서 많이 발생한다. 병발생이 심한 곳은 3~4년간 화본과나 콩과 작물로 돌려짓기를 하고 병든 식물체를 일찍 제거하여 수확 후 이병 잔재물이 포장이 남지 않도록 한다. 병균이 주로 관수, 빗물, 토양곤충 등을 통하여 식물체의 상처부위로 침입하므로 식물체에 상처가 나지 않도록 주의하고 발병이 심한 곳은 재배 전에 토양 살충제를 살포하여 토양곤충을 구제하고 비료의 3요소를 골고루 시비한다. <br> <br> <br> 라. 검은빛 썩음병 <br> 5월과 9~10월경 기온이 낮고 비가 많이 온 후에 발생이 심하다. 이 병균은 종자전염 또는 토양전염을 하는데 비가 오면 흙이 식물체로 튀어 병균이 수공으로 침입을 한다. 병에 걸리면 처음에는 잎에 노란색의 둥근 병반이 생기고 이것이 점차 암갈색으로 변하게 되며 병반부의 엽맥은 흑갈색으로 된다. 심하면 구내부를 흑변시키고 전 포장에 발생한다. 병의 방제를 위하여 종자를 무병포기에서 채종하고 소독하여 이용하며 약제로는 동수화제나 보르도액을 살포한다. <br> <br> <br> 마. 뿌리혹병 <br> 뿌리혹병은 8~9월경 비교적 온도가 낮고 비가 자주 와서 재배지가 습할 때 주로 발생하며 토양산도가 pH6 이하인 산성토양에서 심하게 발생한다. 병든 식물체는 생육이 지연되어 크지 못하고 잎은 황색으로 변하며 점차 아랫잎부터 늘어지고 뿌리에는 크고 작은 여러 개의 혹이 붙어 있다. 발병초기에는 온도가 높은 낮에 식물체가 시들었다가 밤에는 회복되나 병이 진행될수록 뿌리가 썩어 부패하면서 포기전체가 고사한다. 무사마귀병이 심한 곳은 배추과 작물의 연작을 피하고 배추과 이외의 작물로 2~3년간 윤작하며 물빠짐이 나쁜 저습지나 점질토양에서의 재배를 피하고 배수에 유의한다. 토양이 산성인 곳에서 주로 발생하므로 석회를 충분히 시용하여 토성을 중성이나 약알칼리성으로 개량한다. 약제를 이용할 경우는 후루아지남, 후루설파마이드 분제를 정식 전에 살포한다. <br> <br> 2007-10-08"
"홍자단","특징","학 명 : Cotoneaster horizon","홍자단은 중국 서부지방이 원산지이며 cotoneaster에 속하고 일본을 제외한 아시아 전역에 널리 분포되어 자생하고 있는 상록 반낙엽성 식물이다. 5월에 윤기있는 잎과 6월에 아름다운 연분홍색의 작은 꽃이 피고 가을에는 불타는 듯한 작은 단풍잎, 루비와 같은 빨간 열매는 아름다움의 극치를 이룬다. <br> 우리나라에는 cotoneaster에 속하는 식물이 두 품종이 있는데 한 품종은 북한 지역에만 자생하는 개야광나무(C,Gentiana)이고 한 품종은 울릉도에 자생하는 섬개야광나무(c,wilsonii)이다. <br> 열매는 따지 않으면 이듬해 꽃이 필 때까지 달려있으므로 겨울 열매 분재로서 멋있는 나무이다 관리 물주기 <br> 물빠짐이 잘 되는 흙에 심고 햇빛을 충분히 쬐어야 잘 자란다. 물 주 기는 기후, 분토, 분의 크기, 관리 장소, 통풍 상태 등에 따라 다르나 일반적으로 분토 표면이 1/2 정도 하얗게 마르면 충분한 관수를 해주는 것이 알맞다. <br> 보편적으로 봄, 가을에는 아침에 한 번 물을 흠뻑 주고, 여름에는 아침 오후 두 번을 주고 틈틈이 잎에 분무기로 엽수를 해주면 좋다. <br> 작은 분을 사용했을 때는 분을 말리지 않도록 주의해야 한다. 겨울에는 분토가 아주 마르지 않을 정도로 2,3일에 한 번 정도 물을 준다. <br> 분토가 겨울에 꽁꽁 얼어서 물을 주어도 배수가 안될 때에는 큰 물통이나 대야에 물을 담고 분을 그 속에 담가 분토를 완전히 녹여 주어야 한다. 언 상태가 계속되면 나무가 죽게 된다. <br> <br> 거름주기<br> 봄 분갈이 후 20일이 지나서부터 거름주기를 시작한다. 장마철과 개화기만 제외하고는 한 달에 한 번씩 덩어리 거름과 물거름을 l0월 상순까지 계속 준다. <br> 봄 분갈이를 할 때 분토 속에 골분을 조금 넣어주면 매우 열매가 잘 달린다. <br> <br> 분갈이 배양중에 있는 나무는 2년 마다 분갈이를 하는데 14월 초순경 새순이 나오기 전에 하는 것이 좋다. <br> 분에서 뽑은 나무는 묵은 흙을 모두 털어 버리고 굵은 뿌리나 긴 뿌리는 1/2 정도 남기고 잘라 낸다. 봄 분갈이 때는 뿌리를 1/2 정도 자르나 가을 분갈이는 l/1 정도만 자르고 심는다. <br> 밭이나 토분에서 배양된 나무를 감상분에 분올림 할 때도 분갈이 같은 방법으로 손질하나 이때 주의하여야 할 것은 반드시 직근을 바싹 잘라 주고 옆으로 뻗은 뿌리(측근)는 심을 분의 크기에 맞추어 잘라 심는다. 뿌리 사이 사이에 흙이 고루 들어가도록 대나무 꼬챙이로 다져 밀어 넣고 나무가 흔들리지 않도록 고정시켜 심도록 한다. <br> 심은후 물은 흙물이 완전히 빠져 맑은 물이 나올 때까지 흠뻑 주고 이끼는 분 넓이의 1/3 정도 자연스럽게 심어주고 분주위를 깨끗이 정리 한다. 물은 매일 한 번씩 주고 가지에는 분무기로 자주 엽수를 해준다. 분갈이나 분올림이 끝난 것은 바람이 없는 양지바른 곳에 두고 관리하는 것을 잊지 말아야 한다. <br> 병충해및번식 병충해 <br> 홍자단은 비교적 병충해에 강한 나무이나 새순에는 진딧물이 줄기에는 개각충이 잘 생긴다. 진딧물은 눈에 띄는대로 살충제를 뿌려준다. 그리고 개각충을 예방하려면 겨울철 보호실에 들어가기 전과 보호실에서 나올 때 석회 유황 합제 30배액을 골고루 살포해 주면 예방에 효과가 좋다. <br> <br> 번식법 <br> 실생, 꺾꽂이(삽목), 취목이 모두 잘 되는 나무인데 실생은 묘목이 어미나무와는 약간 변형되어 나오며 꽃이 피고 열매를 맺을 때 까지는 오랜 세월이 걸리는 단점이 있으므로 주로 꺾꽂이로 많이 번식시킨다. 꺾꽂이는 4월초새순이 나기 전에 가지를 l0cm정도로 잘드는 가위로 잘라 삽목상에 1/3 정도 묻히게 꽂고 물을 흠뻑 준 후 비닐을 씌우고 2~3일에 한 번씩 상토가 마르지 않게 물을 주고 엽수도하여 준다. <br> 장마철에 접어 들면 삽목이 더 잘된다. 또한 묵은 가지도 삽목이 잘 되므로 소품 만들기에 좋다. 취목은 장마 때에 필요한 가지에 환상박피를 하면 뿌리가 잘 내린다. <br> <br> 배양장소 <br> 햇빛이 잘들고 통풍이 잘되는 곳이 좋으며 가을 단풍이 매우 아름다우므로 9월 이후에 밤이슬을 맞을 수 있는 곳이면 아주 좋다. <br> <br> 2007-10-08"
"꽃사과","형태적특징","학 명 : Malus prunifolia Bo","잎 <br> 낙엽성으로 호생하며 광타원형이다<br> <br> 꽃<br> 4~5월에 개화하며 지름이 3~4cm로 산방화서에 3~7 개가 모여 핀다. <br> <br> 열매<br> 이과는 편구형(扁球形)으로 지름이 6~8mm로서 황색으로 익는다. <br> <br> 가지 및 줄기<br> 수피는 회갈색이다.<br> <br> 주요품종 Malus 'Almey':홀꽃으로 짙은 적자색 또는 적자색을 띠며 열매는 적갈색이고 지름이 거의 2.5cm에 달한다.직립성이며 옆으로 넓게 퍼져 자란다.병충해에 저항력이 강하다. <br> Malus floribunda:꽃봉우리는 짙은 핑크색이며 꽃은 점차적으로 흰색으로 시들고 지름이 2.5cm에 달하고 방향성으로 향기가 짙다.열매는 적황색이며,저항력이 약하고 넓은 원형으로 밀집된 가지를 가지며,다른 꽃사과나무와 비교하여 가장 좋은 꽃사과나무 중의 하나이다. Malus 'Hopa':자주색빛이 또는 적색으로 개화하며, 가운데 흰별무늬가 있는 장미빛을 가지고 있으며 지름이 3~4cm나 되고 8월에 익으며,9월에 떨어진다. <br> Malus 'Red Jade':짙은 분홍색의 꽃봉우리를 가지나 흰색으로 개화하며,열매는 광택이 나는 붉은색을 띤다.열매는 새들이 특히 좋아하고 나무모양은 Weeping 관목으로 알맞다. Malus'Van Eseltine':이 품종은 M. spectabilis와 M. arnoldiana *의 교배로 육종된 것이며,겹꽃으로 13~19장의 꽃잎을 가진다.꽃봉오리는 짙은 장미빛을 띠고 핑크색으로 시든다.꽃의 지름은 4~5cm이고 열매는 갈색을 띠는 황색이다. <br> Malus Pioneer *:이 나무는 Siberian(1767)과 Redvein(1891)의 교배로 육종된 Hopa(1920)와 Sargent(1892)의 교배로 1974년에 심경구 등이 육종한 품종으로 개화기는 Hopa와 Sargent 개화기의 중간정도로서 중부지방에서 4월 중순경이며,내병성을 비롯한 수세가 강건하다.엽색은 짙은 녹색이고 옆판을 지니고 있으며 엽근의 모양이 아름답다.열매는 크기와 형태,빛깔에서 Sargent와 거의 비슷하지만 과육은 황색을 띤 붉은색을 나타낸다. 열매는 매우 견고하여 병충해의 침해를 받거나 낙과되어 버리는 Hopa와는 달리 겨울 늦게까지 달려 있기 때문에 열매의 아름다움을 오래도록 감상할 수 있고 야생조류의 먹이로소 자연보호를 위한 녹화수로 기대되는 나무이다. <br> 재배기술 지름이 3~4cm정도 되는 꽃은 꽃봉우리일 때는 적색,개화하면 홍색을 띠며 흰색이 되어 시든다.열매는 황색 바탕에 적색기운이 돈다.만개하면 꽃이 온나무를 뒤덮어 장관을 이루는 그야말로 대표적인 화교목(花喬木)이다.Malus floribunda 의외에도 꽃사과류는 매우 많은 종류가 있어 종류에 따라 꽃피는시기가 4월말에서 5울말까지 분포하며 꽃색도 흰색에서 적색에 이르기까지 다양하며 열매도 적색,황색 등 여러 색상을 띤다.우리 나라에서는 아직 꽃사과류를 많이 이용하고 있지 못하며,외국에서 들어온 종류들도 제대로 구분하지 못한 상태로 식재하고 있는 실정이고 국내에서 자생하는 꽃사과류의 가치도 아직 인식하고 있지 못한 상태이다.독립수나 가로수로 적합하고,정원,학교,공원,상업용건물,공공건물 및 고속도로변 등에 널리 이용될 수 있다. <br> 2007-10-08"
"인동덩굴","특성","학 명 : Lonicera japonica T","형태적 특성 <br> 잎은 대생하고 엽병은 짧으며 난상 또는 긴 타원형으로 잎 뒷면에는 잔털이 나있고 잎 길이는 8㎝정도로 큰다. 꽃은 2개가 쌍생하며 긴 깔때기 모양의 꽃이 처음에는 흰빛이었다가 후에 황색으로 변한다. 흰꽃과 노랑꽃이 동시에 보이기 때문에 금은화(金銀花)라는 별명이 있다.<br> <br> 생리 생태적 특성<br> 낙엽성 또는 반낙엽, 반상록성 덩굴 식물로 줄기는 연갈색이다. 줄기는 10m정도 자라며 타물체를 우측으로 감고 오라가며 겨울에는 낙엽되기도 한다.<br> 꽃은 향기가 나며 5~6월에 개화한다. 열매는 장과로 공의 모양이다. 가을에 검게 익으며 염색체 수는 2n=18 (Jan Ammal & S.1952)이다.<br> <br> <br> <br> <br> 재배기술 배양토 : 사질양토에서 잘 자라며 화분에서는 밭흙과 부엽, 천사를 5 : 3 : 2의 비율로 혼합하여 재배한다.<br> <br> 일조와 온도 : 반그늘 또는 광선 아래에서 잘 자라고 노지에서 월동 생육한다. 여름에는 환기를 요하며 10~26℃에서 잘 생육한다.<br> <br> 관수 관리 : 보통으로 관리하며 배수가 잘되어야 한다.<br> <br> 번식 : 실생과 삽목, 취목으로 행한다. <br> 이용 인동(忍冬)꽃은 술에 담가 먹으며, 관상용으로 정원이나 화분에 심어 가꿀 수 있다.<br> 줄기 잎 꽃 과실은 함방 및 민간에서 이뇨 해독 종기 부종 감기 지혈 정형 하리(下痢, 이질) 구토 건위 해열 등에 다른 약재와 같이 처방하여 약으로 쓴다.<br> 2007-10-08"
"상추(청하계(고시나-6호))","적응지역 및 재배상의 유의점","육성경위 <br> 청하계는 1997년 추대가","전국 어디에서나 재배가 가능하며, 봄, 가을 노지재배 및 시설재배에 적합하다. 여름철 고온기 육묘 시 발아불량의 우려가 있음으로 적온관리에 유의하여야 하며, 물빠짐이 좋지 않은 토양에서는 부패병 발생에 주의하여야 한다. 최고온기 재배는 피하는 것이 안정생산에 유리하다. <br> <br> 주요특성 가. 고유특성 <br> 신품종 청하계의 형태적 특성은 잎상추로서 청치마이며 잎의 모양은 뒤집어진 계란형이다. 엽색은 회녹색이며, 대비 품종인 강한청치마보다 엽절에 결각이 있고, 추대가 늦은 특성을 가지고 있다 <br> 나. 가변특성 <br> 적하계상추는 강한청치마보다 엽폭이 넓고 엽수가 많아 주당 수량이 5% 정도 많다. <br> 다. 품질 및 내병성 <br> 적하계상추는 식미가 우수하고 무름병의 준저항성으로, 강한청치마보다 병에 강한 편이다. <br> <br> 2007-10-09"
"하국","춘광","습지에서 자란다. 뿌리줄기가 뻗으면서 번식하는","대표적 하국으로서 6월 중하순에 자연개화하는 백색의 대형품종이다. 꽃모양이 우수하고 백색 외에 황색도 있다. 절간신장이 우수하여 빠른 경우 90일만에(정식→개화)수확이 가능하다. 동지아를 이용한 3∼5월 출하가 대부분이다. 꽃목이 길어 B-9처리가 필수적이며 백수병에 대단히 약하다. 일본의 신정홍(백), 섬머옐로우(황)와 생리 생태가 비슷하다.<br> 정운 자연개화기는 6월이나 일장조절에 의해 5∼9월 출하가 가능하다. 순백색의 하국이다. 외형적으로는 백광과 구분하기 어렵고 백수병에는 약한 편이다. 야간온도 25℃ 이상의 고온과 장일조건하에서 기형화나 유아발생이 거의 없다. 즉 고온 적응성이 높고 시장성도 좋다. 적정 화아분화 온도는 17℃, 적일장은 14시간이다. 생육이 왕성하여 흡비력도 강하고 개화의 균일도는 다소 떨어진다. 장일처리로 화아분화 억제가 가능하나 초장 50㎝이상이면 저절로 화아분화 할 수도 있다. 꽃봉오리가 나타날 무렵 잎마름증상이 쉽게 발생한다.<br> 백광 7월 상순경에 자연개화하는 순백색의 하국으로 춘광과 더불어 하국을 대표하는 품종이다. 생육 및 개화형태가 정운과 구분하지 못할 정도로 유사하다. <br> 일장에 있어서도 정운과 유사한 반응을 나타낸다. 춘광에 비해 절간이 짧고 꽃목도 적당하나 꽃이 다소 작고 꽃목이 약하다. <br> 백선 일본 육성품종인 암의백선(岩의白扇)을 약칭해서 부르고 있다. 7월 상순경에 개화하는 하추국으로서 일본에서도 주력품종인 정운을 대체할 신품종으로 주목하고 있다. 무측지성 품종으로서 자연개화기에는 무측지성 발현이 분명하지 않으나 전조억제재배(7월 이후 재배작형)에서는 무측지성이 잘 나타나 정단부아래의 1-3매의 액아만 제거하면 되므로 생력화가 가능하다. 순백색의 대륜으로 자연개화기는 6월 상순이며, 줄기는 직립성이고 단단하다. 잎은 직립이며 결각이 깊고 수확시에 잎이 꺾이지(접히지) 않는다. 물올림, 절화수명이 매우 좋고, 관생화의 발생이 전혀 없는 장점이 있다. 단점으로는 초장 신장이 늦어 재배기간이 115∼125일로 길고 이른 봄에 삽수를 충분히 얻을 수 없으며, 무적심 재배에서는 버들눈이 발생하기 쉽다. 8월 하순 이후에는 기형화가 발생하기 쉽고, 국내에서는 백광에 비해 선호도가 다소 떨어진다.<br> <br> <br> 2007-10-09"
"스프레이 국화","퓨마(Puma)","일본에서 육성된 소국과는 달리 생리적 으로 로","스프레이 국화가 재배량이 늘기 시작하면서 가장 먼저 대두된 백색의 기호성 품종. 착화성이 매우 우수하고 촉성, 억제 재배 등 주년 생산성도 양호하다. 꽃의 직경이 4.5㎝정도이고 화심의 직경은 3∼3.5㎝정도이다. 화심색은 여름에는 황백색, 겨울 저온기에는 녹색이고 흰녹병에 대단히 약하고, 여름 장마철에는 과습의 피해로 노지재배가 거의 불가능할 정도이다. 휀샤인(Funshine) 퓨마와 거의 유사한 크기의 아네모네형 품종이다. 보라색 화색이 돋보인다. 화형은 만개하면 폼폰형에 가깝다. 꽃목은 매우 가늘고 세력도 다소 약하다. 파소 더블(Paso Doble) 화형은 아네모네형이나 퓨마보다는 다소 큰 직경 6㎝내외이다. 꽃잎의 색은 백색이나 화심색이 적갈색이어서 전체적인 색상은 백색보다는 적갈색 색채가 강하다. 고온기 촉성재배에서는 선단부에서 선단위축 증상이 발생할 수 있다. 세력이 매우 강해서 재배가 용이하고 병충해에도 상당히 강하다. <br> <br> 타겟(Target) 역시 화형은 아네모네형, 흰녹병에 대단한 저항성을 가지고 있으며 화색은 진한 보라색으로 봉오리 때는 흑색에 가깝다 백색과 적색이 잘 조화된 복색계 홑꽃 품종이다. 화아분화 반응이 늦어 동계 저온기에는 개화가 늦어지는 단점이 있지만 소비자에게 인기가 있는 품종이다. 중형의 복색계 품종의 선두주자이다. 2007-10-09"
